{
  "schema_version": "1.0.0",
  "mode": "NON_CANONICAL_SHADOW",
  "authority": "CURRENT_CANONICAL_OWNERS_UNCHANGED",
  "known_broken_references": [
    {
      "debt_id": "DOC-REF-DEBT-001",
      "source_path": "docs/HANDOFF.md",
      "source_line": 146,
      "target": "docs/RETOMAR.md",
      "status": "DEFERRED",
      "owner": "docs/DOCUMENTATION_INDEX.md",
      "reason": "Known legacy handoff target absent; preserve as required test case.",
      "future_resolution_unit": "GOVERNANCE-EFFICIENCY-REFOUNDATION-UNIT-3"
    },
    {
      "debt_id": "DOC-REF-DEBT-002",
      "source_path": "docs/architecture/DOCUMENTS_INGESTOR_CONSUMER_DESIGN.md",
      "source_line": 51,
      "target": "docs/CONTROL_TAPETES_DOCUMENTS_CONTRACT.md",
      "status": "DEFERRED",
      "owner": "docs/DOCUMENTATION_INDEX.md",
      "reason": "Root-relative target absent; component contract exists outside this location.",
      "future_resolution_unit": "GOVERNANCE-EFFICIENCY-REFOUNDATION-UNIT-3"
    },
    {
      "debt_id": "DOC-REF-DEBT-003",
      "source_path": "docs/architecture/DOCUMENTS_INGESTOR_CONSUMER_DESIGN.md",
      "source_line": 54,
      "target": "docs/architecture/G10_CONTROLE_TAPETES_INTEGRATION_DESIGN.md",
      "status": "DEFERRED",
      "owner": "docs/DOCUMENTATION_INDEX.md",
      "reason": "Root-relative target absent; component design exists outside this location.",
      "future_resolution_unit": "GOVERNANCE-EFFICIENCY-REFOUNDATION-UNIT-3"
    },
    {
      "debt_id": "DOC-REF-DEBT-004",
      "source_path": "docs/architecture/ORDEM_COMPRA_C5_PHASE_CONTRACT.md",
      "source_line": 60,
      "target": "docs/governance/CODE_HEALTH_RULES.md",
      "status": "DEFERRED",
      "owner": "docs/DOCUMENTATION_INDEX.md",
      "reason": "Recorded path is stale; canonical file is under docs/architecture.",
      "future_resolution_unit": "GOVERNANCE-EFFICIENCY-REFOUNDATION-UNIT-3"
    },
    {
      "debt_id": "DOC-REF-DEBT-005",
      "source_path": "docs/architecture/ORDEM_COMPRA_LIFECYCLE_SPEC_PROPOSED.md",
      "source_line": 102,
      "target": "docs/reports/PURCHASE_ORDER_FOUNDATION_AUDIT_R1_2026-07-18.md",
      "status": "DEFERRED",
      "owner": "docs/DOCUMENTATION_INDEX.md",
      "reason": "Referenced diagnostic report is not tracked.",
      "future_resolution_unit": "GOVERNANCE-EFFICIENCY-REFOUNDATION-UNIT-3"
    },
    {
      "debt_id": "DOC-REF-DEBT-006",
      "source_path": "docs/architecture/ORDEM_COMPRA_LIFECYCLE_SPEC_PROPOSED.md",
      "source_line": 3023,
      "target": "docs/reports/PURCHASE_ORDER_FOUNDATION_AUDIT_R1_2026-07-18.md",
      "status": "DEFERRED",
      "owner": "docs/DOCUMENTATION_INDEX.md",
      "reason": "Repeated historical reference to the same untracked diagnostic report.",
      "future_resolution_unit": "GOVERNANCE-EFFICIENCY-REFOUNDATION-UNIT-3"
    }
  ],
  "artifacts": [
    {
      "artifact_id": "DOC-AGENT_HANDOFF_MD",
      "path": "AGENT_HANDOFF.md",
      "classification": "HANDOFF",
      "authority": "DERIVED",
      "owner": "AGENT_HANDOFF.md",
      "bootstrap_tier": "TIER_1_MANDATORY",
      "status": "ACTIVE",
      "disposition": "GENERATE_DERIVED_VIEW",
      "generated_status": "MANUAL",
      "role": "derived",
      "content_hash": "6e676210abac4911219a2476b6a5f94eb921d047a45f3d4bc2168306c4554aa3",
      "line_count": 1081,
      "byte_count": 76098,
      "inbound_references": 373,
      "outbound_references": 73,
      "survival_destination": "AGENT_HANDOFF.md",
      "compatibility_pointer": null,
      "review_status": "REVIEWED",
      "review_basis": "Explicit R1 review against DOCUMENTATION_INDEX classification, DOCUMENTATION_MODEL ownership, source heading, and governed path category."
    },
    {
      "artifact_id": "DOC-AGENTS_MD",
      "path": "AGENTS.md",
      "classification": "ENTRYPOINT",
      "authority": "NONE",
      "owner": "AGENTS.md",
      "bootstrap_tier": "TIER_0_ENTRY",
      "status": "ACTIVE",
      "disposition": "KEEP_NORMATIVE",
      "generated_status": "MANUAL",
      "role": "entrypoint",
      "content_hash": "e79221f30edbbe9ddf6fee1eafe895a156bfa437bacd3ac53de2a66d7b0aea56",
      "line_count": 6,
      "byte_count": 206,
      "inbound_references": 52,
      "outbound_references": 1,
      "survival_destination": "AGENTS.md",
      "compatibility_pointer": null,
      "review_status": "REVIEWED",
      "review_basis": "Explicit R1 review against DOCUMENTATION_INDEX classification, DOCUMENTATION_MODEL ownership, source heading, and governed path category."
    },
    {
      "artifact_id": "DOC-CLAUDE_MD",
      "path": "CLAUDE.md",
      "classification": "ENTRYPOINT",
      "authority": "NONE",
      "owner": "CLAUDE.md",
      "bootstrap_tier": "TIER_0_ENTRY",
      "status": "ACTIVE",
      "disposition": "KEEP_NORMATIVE",
      "generated_status": "MANUAL",
      "role": "entrypoint",
      "content_hash": "e79221f30edbbe9ddf6fee1eafe895a156bfa437bacd3ac53de2a66d7b0aea56",
      "line_count": 6,
      "byte_count": 206,
      "inbound_references": 51,
      "outbound_references": 1,
      "survival_destination": "CLAUDE.md",
      "compatibility_pointer": null,
      "review_status": "REVIEWED",
      "review_basis": "Explicit R1 review against DOCUMENTATION_INDEX classification, DOCUMENTATION_MODEL ownership, source heading, and governed path category."
    },
    {
      "artifact_id": "DOC-DOCS_AI_AGENT_RULES_MD",
      "path": "docs/AI_AGENT_RULES.md",
      "classification": "LEGACY",
      "authority": "HISTORY_ONLY",
      "owner": "docs/AI_AGENT_RULES.md",
      "bootstrap_tier": "TIER_4_HISTORY",
      "status": "LEGACY",
      "disposition": "INVESTIGATE_UNIQUE_CONTENT",
      "generated_status": "MANUAL",
      "role": "history",
      "content_hash": "a9b7cf94ced003bcd7cfe7677532afbcacf0aa7bea7f21b92e19e1ae9c8d2d22",
      "line_count": 85,
      "byte_count": 4083,
      "inbound_references": 5,
      "outbound_references": 5,
      "survival_destination": "docs/AI_AGENT_RULES.md",
      "compatibility_pointer": "docs/DOCUMENTATION_INDEX.md",
      "review_status": "REVIEWED",
      "review_basis": "Explicit R1 review against DOCUMENTATION_INDEX classification, DOCUMENTATION_MODEL ownership, source heading, and governed path category."
    },
    {
      "artifact_id": "DOC-DOCS_ARCHITECTURE_AUTH_DELETE_USER_DESIGN_MD",
      "path": "docs/architecture/AUTH_DELETE_USER_DESIGN.md",
      "classification": "CONTRACT",
      "authority": "NORMATIVE",
      "owner": "docs/architecture/AUTH_DELETE_USER_DESIGN.md",
      "bootstrap_tier": "TIER_3_REFERENCE",
      "status": "ACTIVE",
      "disposition": "KEEP_NORMATIVE",
      "generated_status": "MANUAL",
      "role": "normative",
      "content_hash": "c1ef399dd2922e3fb4a61c39c1353232c7fdd845501b0ac47fc7cad50cd15470",
      "line_count": 755,
      "byte_count": 26980,
      "inbound_references": 12,
      "outbound_references": 5,
      "survival_destination": "docs/architecture/AUTH_DELETE_USER_DESIGN.md",
      "compatibility_pointer": null,
      "review_status": "REVIEWED",
      "review_basis": "Explicit R1 review against DOCUMENTATION_INDEX classification, DOCUMENTATION_MODEL ownership, source heading, and governed path category."
    },
    {
      "artifact_id": "DOC-DOCS_ARCHITECTURE_AUTH_PROVISIONING_EDGE_DESIGN_MD",
      "path": "docs/architecture/AUTH_PROVISIONING_EDGE_DESIGN.md",
      "classification": "CONTRACT",
      "authority": "NORMATIVE",
      "owner": "docs/architecture/AUTH_PROVISIONING_EDGE_DESIGN.md",
      "bootstrap_tier": "TIER_3_REFERENCE",
      "status": "ACTIVE",
      "disposition": "KEEP_NORMATIVE",
      "generated_status": "MANUAL",
      "role": "normative",
      "content_hash": "62e33c3951274d70db15477152b859d34a1132d5dada7e049d99d8ccbbc40af6",
      "line_count": 398,
      "byte_count": 14879,
      "inbound_references": 9,
      "outbound_references": 1,
      "survival_destination": "docs/architecture/AUTH_PROVISIONING_EDGE_DESIGN.md",
      "compatibility_pointer": null,
      "review_status": "REVIEWED",
      "review_basis": "Explicit R1 review against DOCUMENTATION_INDEX classification, DOCUMENTATION_MODEL ownership, source heading, and governed path category."
    },
    {
      "artifact_id": "DOC-DOCS_ARCHITECTURE_CAMADA2_USUARIOS_SPEC_PROPOSED_MD",
      "path": "docs/architecture/CAMADA2_USUARIOS_SPEC_PROPOSED.md",
      "classification": "CONTRACT",
      "authority": "NORMATIVE",
      "owner": "docs/architecture/CAMADA2_USUARIOS_SPEC_PROPOSED.md",
      "bootstrap_tier": "TIER_3_REFERENCE",
      "status": "ACTIVE",
      "disposition": "KEEP_NORMATIVE",
      "generated_status": "MANUAL",
      "role": "normative",
      "content_hash": "7b232c47b0721c04ae4f3d1d553e9e5b350a0909ae0c918e1070d623b8bc9a2a",
      "line_count": 586,
      "byte_count": 31223,
      "inbound_references": 61,
      "outbound_references": 11,
      "survival_destination": "docs/architecture/CAMADA2_USUARIOS_SPEC_PROPOSED.md",
      "compatibility_pointer": null,
      "review_status": "REVIEWED",
      "review_basis": "Explicit R1 review against DOCUMENTATION_INDEX classification, DOCUMENTATION_MODEL ownership, source heading, and governed path category."
    },
    {
      "artifact_id": "DOC-DOCS_ARCHITECTURE_CAMADA3_BACKUP_CONTRACT_MD",
      "path": "docs/architecture/CAMADA3_BACKUP_CONTRACT.md",
      "classification": "CONTRACT",
      "authority": "NORMATIVE",
      "owner": "docs/architecture/CAMADA3_BACKUP_CONTRACT.md",
      "bootstrap_tier": "TIER_3_REFERENCE",
      "status": "ACTIVE",
      "disposition": "KEEP_NORMATIVE",
      "generated_status": "MANUAL",
      "role": "normative",
      "content_hash": "5d94f2343d7e9d3e045abdea48e839b6be98d20322a77779b340a41d01a13301",
      "line_count": 547,
      "byte_count": 31542,
      "inbound_references": 20,
      "outbound_references": 14,
      "survival_destination": "docs/architecture/CAMADA3_BACKUP_CONTRACT.md",